{
  "$schema": "https://json-schema.org/draft/2020-12/schema",
  "$id": "https://agentbootup.dev/schemas/env-config-v01.schema.json",
  "$comment": "$id is a logical identifier only — this URL is not currently resolvable. Validators that dereference $id as a network URI should treat 404 as non-fatal.",
  "title": "agentbootup Environment Config (env-config v0.1)",
  "description": "Schema for <env>-env.json files consumed by `agentbootup mount --env-config <path>`. Implements DEC-024 per-environment approval semantics.",
  "type": "object",
  "required": [
    "schema_version",
    "environment",
    "brain_allowlist",
    "environment_skills",
    "secret_source",
    "routing_target",
    "approval_flow"
  ],
  "additionalProperties": false,
  "properties": {
    "schema_version": {
      "type": "string",
      "description": "Schema version identifier. Current: \"0.1\". agentbootup rejects configs where the major version is unknown or greater than supported.",
      "pattern": "^[0-9]+\\.[0-9]+(\\.[0-9]+)?$",
      "examples": ["0.1"]
    },
    "environment": {
      "type": "string",
      "description": "Short kebab-case identifier for this environment. Used in log output, mount.json, and status reporting.",
      "pattern": "^[a-z][a-z0-9-]*$",
      "examples": ["decisive", "teleporter", "helloconvo"]
    },
    "brain_allowlist": {
      "type": "array",
      "description": "Brain IDs permitted to mount in this environment. Must be explicitly declared — omitting is a hard error. An empty array means no brains are permitted.",
      "items": {
        "type": "string",
        "pattern": "^[a-z][a-z0-9-]*$"
      },
      "examples": [["decisive", "bootup", "teleporter"]]
    },
    "environment_skills": {
      "type": "object",
      "description": "Environment-specific skill layer overlaid on top of core + brain skills at mount time (DEC-002 three-layer composition).",
      "required": ["path"],
      "additionalProperties": false,
      "properties": {
        "path": {
          "type": "string",
          "description": "Path to environment-specific skills directory, relative to the env config file's location."
        },
        "optional": {
          "type": "boolean",
          "default": false,
          "description": "If false: path not existing is a hard error — mount fails. If true: path not existing produces a warning and the layer is skipped. Default: false. Use optional:true only for genuinely optional capability layers."
        }
      }
    },
    "local_tools_path": {
      "type": ["string", "null"],
      "description": "Path to local tools available in this environment. null or omitted = no local tools. Reserved field in v1: read and stored in mount.json but not acted on. Phase 4+."
    },
    "secret_source": {
      "type": "object",
      "description": "How environment-level secrets are injected at mount time. Additive to Phase 1b brain-level secrets.",
      "required": ["provider", "namespace"],
      "additionalProperties": false,
      "properties": {
        "provider": {
          "type": "string",
          "description": "Secret provider. Only \"mech-vault\" is supported in v1.",
          "enum": ["mech-vault"]
        },
        "namespace": {
          "type": "string",
          "description": "Vault namespace to read from. Mixed case allowed (^[a-zA-Z0-9-]+$): vault namespace strings can contain uppercase letters (e.g. production values may differ from kebab-case env names). This is intentional and differs from the lowercase-only patterns used for environment and brain IDs.",
          "pattern": "^[a-zA-Z0-9-]+$"
        }
      }
    },
    "routing_target": {
      "type": "object",
      "description": "Where messages sent to a mounted brain are routed.",
      "required": ["provider", "endpoint", "approval_mode"],
      "additionalProperties": false,
      "properties": {
        "provider": {
          "type": "string",
          "description": "Routing provider. Only \"mech-plane\" is supported in v1.",
          "enum": ["mech-plane"]
        },
        "endpoint": {
          "type": "string",
          "description": "Base URL of the mech-plane instance.",
          "format": "uri"
        },
        "approval_mode": {
          "type": "string",
          "description": "Approval mode passed as approvalMode to POST /orchestrate.",
          "enum": ["full-auto", "confidence", "manual"]
        }
      }
    },
    "approval_flow": {
      "type": "object",
      "description": "How tool call approvals are handled for sessions spawned in this environment. Drives agentbootup hook policy at mount time (DEC-024). Mechanism-inapplicable fields are rejected so the frozen approval contract reaches runtime without smuggled bypass data.",
      "required": ["mechanism"],
      "additionalProperties": false,
      "properties": {
        "mechanism": {
          "type": "string",
          "description": "\"mech-plane\": agentbootup strips PermissionRequest hooks from settings; mech-plane onToolCall gate is canonical. \"teleporter_hook\": hooks remain; TELEPORTATION_PARENT_SESSION_ID must be set or mount hard-fails.",
          "enum": ["mech-plane", "teleporter_hook"]
        },
        "endpoint": {
          "type": "string",
          "description": "Approval endpoint. Required when mechanism is \"mech-plane\".",
          "examples": ["POST /orchestrate/approve"]
        },
        "parent_session_id_var": {
          "type": "string",
          "description": "Env var name to check at mount time. Required when mechanism is \"teleporter_hook\".",
          "examples": ["TELEPORTATION_PARENT_SESSION_ID"]
        }
      },
      "allOf": [
        {
          "if": {
            "properties": { "mechanism": { "const": "mech-plane" } },
            "required": ["mechanism"]
          },
          "then": {
            "required": ["endpoint"],
            "not": { "required": ["parent_session_id_var"] }
          }
        },
        {
          "if": {
            "properties": { "mechanism": { "const": "teleporter_hook" } },
            "required": ["mechanism"]
          },
          "then": {
            "required": ["parent_session_id_var"],
            "not": { "required": ["endpoint"] }
          }
        }
      ]
    }
  }
}
